{
  "effect_ack_done": false,
  "event_id": "qikvrt-push-a3e4068a87fc865cf572a192",
  "final_pass": false,
  "frame_sha256": "2d1e084b7deee2c2f6467081d48d55c3ba9ce771e0f06e993d315c5cd710c49e",
  "next_deterministic_effect": "REFRESH_REPOSITORY_CAPABILITY_AND_PROGRESS_STATE",
  "observed_at": "2026-07-28T13:18:39Z",
  "pass": false,
  "payload_sha256": "1d55c4640854dbd4b4100b8c13b18d2d317a436c3b9ec9708a9980d12fab6eba",
  "productive_progress_claimed": false,
  "schema": "qikvrt_effect_ack_event_frame_v1",
  "source": {
    "actor": "ingolf-lohmann",
    "delivery_hint": "30362866791",
    "event_name": "push",
    "ref": "refs/heads/agent/event-driven-monitor-watchdog-effect-ack-v1",
    "repository": "Goldkelch/qik-vrt",
    "run_attempt": 1,
    "run_id": 30362866791,
    "sha": "fc7e1528444da331cc336c7fe9d0afcbc25f44f0"
  },
  "state": "EFFECT_ACK_CONTINUE"
}
